Comment,VideoId,VideoUrl
Excelente explicacion!,A41Xtv_tatE,https://www.youtube.com/watch?v=A41Xtv_tatE
"muchas gracias por sus vídeos, han sido de mucha utilidad.<br>Podría realizar unos vídeos sobre los temas: campos de direcciones y teorema de existencia y unicidad, gracias",A41Xtv_tatE,https://www.youtube.com/watch?v=A41Xtv_tatE
Profe muchas gracias voy a un cuarto del curso y todo muy bien explicado.,A41Xtv_tatE,https://www.youtube.com/watch?v=A41Xtv_tatE
"Buenas Profe Alex, gracias por el curso, esta muy bueno en serio y estoy aprendiendo bien los casos de ecuaciones diferenciales, exitos!",A41Xtv_tatE,https://www.youtube.com/watch?v=A41Xtv_tatE
Después de ecuaciones diferenciales que capítulo debería aprender,A41Xtv_tatE,https://www.youtube.com/watch?v=A41Xtv_tatE
Holas podría recomendar libros acabo de ingresar a uni,A41Xtv_tatE,https://www.youtube.com/watch?v=A41Xtv_tatE
"wey, te amo, gracias, ya no voy a  reprobar",A41Xtv_tatE,https://www.youtube.com/watch?v=A41Xtv_tatE
Profe haga cursos de física ☺☺☺..  usted es muy bueno en hacer entendernos...!,A41Xtv_tatE,https://www.youtube.com/watch?v=A41Xtv_tatE
"profe, podria hacer un video de ED homageneas, exactas, bernulli, y riccati por favor",A41Xtv_tatE,https://www.youtube.com/watch?v=A41Xtv_tatE
Todo lo que se hace con empeño y dedicación al final se tendrá una gran recompensa.<br>Llegara lejos profe alex<br>Guarden este comentario.,A41Xtv_tatE,https://www.youtube.com/watch?v=A41Xtv_tatE
profe buen video,A41Xtv_tatE,https://www.youtube.com/watch?v=A41Xtv_tatE
profe yo propongo un ejercicio...Encontrar la ecuación diferencial que tiene como solución general la indicada a continuación...                  Y= c1sin2X + c2cos2X          <br>u otro ejercicio seria...  (x-a)^2 + (y-b)^2=1<br>gracias profe!,A41Xtv_tatE,https://www.youtube.com/watch?v=A41Xtv_tatE
"por eso tienes mas de 1 millon de suscriptores, es por que eres bueno para enseñar!!!! lo que no entendí en la escuela, contigo lo estoy entendiendo. saludos profe...",A41Xtv_tatE,https://www.youtube.com/watch?v=A41Xtv_tatE
"Ay noo, enserio gracias, gracias a usted he logrado entender muchísimos temas. Bendito el día en que encontré su canal jaja. ❤",A41Xtv_tatE,https://www.youtube.com/watch?v=A41Xtv_tatE
Profe... puedo ir al baño? :v,A41Xtv_tatE,https://www.youtube.com/watch?v=A41Xtv_tatE
Like si mañana tienen prueba =(,A41Xtv_tatE,https://www.youtube.com/watch?v=A41Xtv_tatE
"Buenas profesor Alex, seria genial que hiciera algunas ecuaciones diferenciales Homogeneas, tambien Exactas y de Bernoli",A41Xtv_tatE,https://www.youtube.com/watch?v=A41Xtv_tatE
Profe sigue haciendo más vídeos a ver si paso la materia ...Tengo un profesor super malo que nadie le entiende.,A41Xtv_tatE,https://www.youtube.com/watch?v=A41Xtv_tatE
Son complejos éste tema. Hay que mirar definitivamente los cursos de Integrales y Derivadas. Buen ejercicio profe Alex,A41Xtv_tatE,https://www.youtube.com/watch?v=A41Xtv_tatE
Explicas mejor que mi profe de matematicas buen video profe,A41Xtv_tatE,https://www.youtube.com/watch?v=A41Xtv_tatE
Usted es él mejor profesor!!!! Gracias a usted pude pasar mi examen de TSC.,A41Xtv_tatE,https://www.youtube.com/watch?v=A41Xtv_tatE
Lo q aprendí en 5 años lo aprendí en 10 minutos,A41Xtv_tatE,https://www.youtube.com/watch?v=A41Xtv_tatE
En donde enseñas ?,A41Xtv_tatE,https://www.youtube.com/watch?v=A41Xtv_tatE
disculpe esto esta bien<br> {3 – 2 [6 (5 + 3(2 - 4) + 4)-3 (2 (5 + 1) +3) ] + 4} =<br>. {3 – 2 [6 (5 + 3 (2) + 4 ) -3 (2 (6) +3) ] + 4}<br>{3 – 2 [6 (5 + 6 + 4 ) – 3 ( 12 + 3 ) ] + 4 }<br>{3 – 2 [6 (15 ) – 3 ( 15 ) ] + 4 }<br>{3 – 2 [ 90 – 45 ] + 4 }<br>{3 – 2 [ 45 ] + 4 }<br>{3 – 90 + 4 }<br>{-83}<br>-83,A41Xtv_tatE,https://www.youtube.com/watch?v=A41Xtv_tatE
deverias ser mi profesor del colegio,A41Xtv_tatE,https://www.youtube.com/watch?v=A41Xtv_tatE
Jaja mañana es mi examen y necesito las demás ecuaciones diferenciales,A41Xtv_tatE,https://www.youtube.com/watch?v=A41Xtv_tatE
OH nuevos ejemplos :,A41Xtv_tatE,https://www.youtube.com/watch?v=A41Xtv_tatE
"Excelente curso  profesor, sigo su curso desde el primer video, ya ansío la siguiente lección",A41Xtv_tatE,https://www.youtube.com/watch?v=A41Xtv_tatE
Ej de caida libre calcular el tiempo que tarda en caer al piso un cuerpo que se deja caer desde la terraza de una casa de una altura 12metros calcular tambien su velocidac con la que cae a<br> Piso neceskto una resp: tuya,A41Xtv_tatE,https://www.youtube.com/watch?v=A41Xtv_tatE
"Me gusta como explicas, pero tengo examen la otra semana pero se tratará sobre ejercicios más avanzados, buen video",A41Xtv_tatE,https://www.youtube.com/watch?v=A41Xtv_tatE
Necesito saber fisica caida libre y tiro  vertical profre particular porque nosotros usamos fromulas un problema este el problema que me dejo  una persona ubicada en un alto de una torre se le cae una pinza que tarda 3 segundos en lugar al suelo calcula cual es <br>A la altura de la torre <br>B la velocida ccon la pinza  llega al suelo   <br>3 un nadador cae trampolin de 6 metros de altura calcula <br>A el tiempo que demora al llegar al agua <br>B .la velocida con que entra al agua<br>Ahi te deje a asi haces en el video con tu ayuda entiendo rapido,A41Xtv_tatE,https://www.youtube.com/watch?v=A41Xtv_tatE
Gracias me ayudo mucho a hacer mi tarea,A41Xtv_tatE,https://www.youtube.com/watch?v=A41Xtv_tatE
"Profesor, sé que mi comentario no viene acorde al tema de la clase.<br><br>Pero profe en verdad que nos gustaría, nos ayudará con métodos de conteo y ejercicios.",A41Xtv_tatE,https://www.youtube.com/watch?v=A41Xtv_tatE
octavo comentario,A41Xtv_tatE,https://www.youtube.com/watch?v=A41Xtv_tatE
La verdad a mi me gustan muchos tus videos por que tu sabes explicar muy bien los temas  <br>GRACIAS :),A41Xtv_tatE,https://www.youtube.com/watch?v=A41Xtv_tatE
Buen video gracias Profe 😘😉,A41Xtv_tatE,https://www.youtube.com/watch?v=A41Xtv_tatE
saludos desde Ecuador,A41Xtv_tatE,https://www.youtube.com/watch?v=A41Xtv_tatE
Tengo mi examen en menos de una semana y no creo que lo vaya a aprobar.😩,A41Xtv_tatE,https://www.youtube.com/watch?v=A41Xtv_tatE
Alfin ya aprendi jaja,A41Xtv_tatE,https://www.youtube.com/watch?v=A41Xtv_tatE
Lo unico que se es que la campanita sirve  buen video profe,A41Xtv_tatE,https://www.youtube.com/watch?v=A41Xtv_tatE
"profe muchas gracias, con tus videos si logro aprender.",kufA4JGm_sU,https://www.youtube.com/watch?v=kufA4JGm_sU
"Muchas gracias Alex!! eres ya de la familia!! esto me sonaba a chino, haces que las matemáticas sean fáciles!! :)",kufA4JGm_sU,https://www.youtube.com/watch?v=kufA4JGm_sU
"muchas gracias profe, siempre sus vídeos me dejan más claras las cosas. Bendiciones!",kufA4JGm_sU,https://www.youtube.com/watch?v=kufA4JGm_sU
"tiene videos de ecuación de Bernoulli, Ricati y factores integrantes?",kufA4JGm_sU,https://www.youtube.com/watch?v=kufA4JGm_sU
"Gracias profe Alex, ojalá que mi profesor explicara cómo usted 🥺😞",kufA4JGm_sU,https://www.youtube.com/watch?v=kufA4JGm_sU
"Profe tiene videos de transformada de laplace?<br><br>Es que es al único profe que le entiendo, muchísimas gracias.",kufA4JGm_sU,https://www.youtube.com/watch?v=kufA4JGm_sU
Tiene videos de ecuaciones difenciales exactas? Esto me ayudo mucho,kufA4JGm_sU,https://www.youtube.com/watch?v=kufA4JGm_sU
"Muchas gracias, excelente video!",kufA4JGm_sU,https://www.youtube.com/watch?v=kufA4JGm_sU
"profe el ejercicio de practica fue el mismo que usted explicó anteriormente, lo resolví sin darme cuenta ;V, quiere decir que si aprendí, gracias :)",kufA4JGm_sU,https://www.youtube.com/watch?v=kufA4JGm_sU
Profe... el ejercicio de práctica que nos dejó era el mismo del ejemplo... para que vea que estamos atentos a todo jejeje,kufA4JGm_sU,https://www.youtube.com/watch?v=kufA4JGm_sU
Llegué aquí con ecuaciones de primer grado y ahora estoy en ecuaciones diferenciales. <br>Casi cuando salieron estos videos yo venía empezando. Ahhh...bonito camino.,kufA4JGm_sU,https://www.youtube.com/watch?v=kufA4JGm_sU
"Usted es el mejor profesor usted si inspira y explica super bien teoría y ejercicios, lo admiro mucho enserio gracias por sus ejemplos y ejercicios, lo felicito y usted es un verdadero profesor 🌹💕",kufA4JGm_sU,https://www.youtube.com/watch?v=kufA4JGm_sU
Gracias me gusta como explica por que dice de donde sale cada valor.,kufA4JGm_sU,https://www.youtube.com/watch?v=kufA4JGm_sU
"Sos un capo, profe! Mil gracias!!",kufA4JGm_sU,https://www.youtube.com/watch?v=kufA4JGm_sU
"Profe usted es un berraco, muchas veces utilizo sus videos cortos para empaparme de la clase, agradezco mucho su buena voluntad y contenido. :)",kufA4JGm_sU,https://www.youtube.com/watch?v=kufA4JGm_sU
10 de 10 el vídeo profe :),kufA4JGm_sU,https://www.youtube.com/watch?v=kufA4JGm_sU
"profe con usted aprendo mejor , saludos",kufA4JGm_sU,https://www.youtube.com/watch?v=kufA4JGm_sU
Excelente!! gracias profesor Alex,kufA4JGm_sU,https://www.youtube.com/watch?v=kufA4JGm_sU
me  ayudo   en monton,kufA4JGm_sU,https://www.youtube.com/watch?v=kufA4JGm_sU
el mejor profesor de matematicas de la historia,kufA4JGm_sU,https://www.youtube.com/watch?v=kufA4JGm_sU
Profe llegué a sus videos por estadística y ahora me encuentro con esto. Usted hace que uno le tome cariño a las matemáticas. <br>Que manera de enseñar claramente. Un abrazo,kufA4JGm_sU,https://www.youtube.com/watch?v=kufA4JGm_sU
muy hábil,kufA4JGm_sU,https://www.youtube.com/watch?v=kufA4JGm_sU
"Matequemáticas 😂 <a href=""https://www.youtube.com/watch?v=kufA4JGm_sU&amp;t=538"">8:58</a>",kufA4JGm_sU,https://www.youtube.com/watch?v=kufA4JGm_sU
A salvar el semestre..,kufA4JGm_sU,https://www.youtube.com/watch?v=kufA4JGm_sU
pero porque la exponencial tiene que ser con el logaritmo no entiendo esa parte,kufA4JGm_sU,https://www.youtube.com/watch?v=kufA4JGm_sU
profe alex buenas tengo una duda. tengo una funcion ln5x si lo derivo y lo simplifico y luego lo integro ya no es  la misma funcion esto afecta en algo en la ecuaciones diferenciales,kufA4JGm_sU,https://www.youtube.com/watch?v=kufA4JGm_sU
"Profe el ejercicio para que nosotros resolvamos es el mismo al que usted hizo, pero igual usted es mi ángel de la guarda pdta: te amo profe",kufA4JGm_sU,https://www.youtube.com/watch?v=kufA4JGm_sU
Ahorita en Ecuaciones diferenciales me esta costando mucho y los videos me están ayudando🤠,kufA4JGm_sU,https://www.youtube.com/watch?v=kufA4JGm_sU
ES EL MEJOR EXPLICANDO! Espero con ansias que suba videos explicando las ecuaciones homogeneas y las exactas.,kufA4JGm_sU,https://www.youtube.com/watch?v=kufA4JGm_sU
Buenisimo saludos,kufA4JGm_sU,https://www.youtube.com/watch?v=kufA4JGm_sU
Profe podría explicar qué es la mecánica de fluidos y los principios de arquímedes y bernoulli?<br>Por favor!!! A usted sí le entiendo jejeje,kufA4JGm_sU,https://www.youtube.com/watch?v=kufA4JGm_sU
"Hola ,me gustaria que subieras el teorema de PITOT Y PONCELET porfavor profe :)",kufA4JGm_sU,https://www.youtube.com/watch?v=kufA4JGm_sU
"Buen vídeo, espero que alcances los 2 millones pronto. Uwu",kufA4JGm_sU,https://www.youtube.com/watch?v=kufA4JGm_sU
Muchas gracias Profe ALex podria aser un video de Area de figuras planas  gracias 😃😄😃🙋,kufA4JGm_sU,https://www.youtube.com/watch?v=kufA4JGm_sU
Hola profe Alex me podría ayudar  a decirme cuál es la excepción de un número elevado ala 0 ????,kufA4JGm_sU,https://www.youtube.com/watch?v=kufA4JGm_sU
"No ignorar por favor:<br>Hola, se q no tiene nada q ver pero, estoy atascada en un problema y es así:<br>&quot;Para una fiesta se compran 18 bocadillos que han costado 44€, en total. Los bocadillos son de queso y jamón. Si cada bocadillo de queso vale 2€ y cada bocadillo de jamón vale 3€, quantos bocadillos hay de cada tipo??&quot;<br><br><br>Para resolverlo yo he hecho esto:<br>2x+3x=44 <br>x=8,8 <br>Pero creo q tengo q usar el 18 pero no sé como hacerlo, y creo q lo he hecho mal, necesito ayuda por favor.",kufA4JGm_sU,https://www.youtube.com/watch?v=kufA4JGm_sU
Buén Video....El Ln(y) sería también el logaritmo neperiano de Y....,kufA4JGm_sU,https://www.youtube.com/watch?v=kufA4JGm_sU
Gracias a Dios y a usted que no me falta sabiduría gracias profe Alex muy buena explicación,kufA4JGm_sU,https://www.youtube.com/watch?v=kufA4JGm_sU
La condición es una desigualdad.,kufA4JGm_sU,https://www.youtube.com/watch?v=kufA4JGm_sU
eres un profe del colegio ????,kufA4JGm_sU,https://www.youtube.com/watch?v=kufA4JGm_sU
Puedes hacer un vídeo de óperaciones de fracciones que lleven suma resta división y multiplicación osea que una fracción lleve todos esos signos <br><br>Buen video jeje,kufA4JGm_sU,https://www.youtube.com/watch?v=kufA4JGm_sU
Parce usted es el mejor. El profesor sanabria no explica un culo,kufA4JGm_sU,https://www.youtube.com/watch?v=kufA4JGm_sU
Esplica mejor que mi profe☺,kufA4JGm_sU,https://www.youtube.com/watch?v=kufA4JGm_sU
Gracias profe alex me salvaste con  tu explicacion pude recuperar mi materia de matematicas y muchas gracias dios te bendiga,kufA4JGm_sU,https://www.youtube.com/watch?v=kufA4JGm_sU
"Profe Alex Dios lo bendiga, 🤝🙏me caen como anillo al dedo estos temas, ya q en este semestre los estoy viendo 📏✏️📝",kufA4JGm_sU,https://www.youtube.com/watch?v=kufA4JGm_sU
Necesito más de ecuaciones diferenciales :),kufA4JGm_sU,https://www.youtube.com/watch?v=kufA4JGm_sU
"Muchas Gracias Profe alex, me gustan tus videos",kufA4JGm_sU,https://www.youtube.com/watch?v=kufA4JGm_sU
Aprendo aprendo aprendo,kufA4JGm_sU,https://www.youtube.com/watch?v=kufA4JGm_sU
buen video,kufA4JGm_sU,https://www.youtube.com/watch?v=kufA4JGm_sU
Gracias aprendí mirando tus videos de verdad gracias,kufA4JGm_sU,https://www.youtube.com/watch?v=kufA4JGm_sU
Profe alex me gusta sus clases y gracis,kufA4JGm_sU,https://www.youtube.com/watch?v=kufA4JGm_sU
Eres el mejor explicando este tipo de cosas,kufA4JGm_sU,https://www.youtube.com/watch?v=kufA4JGm_sU
"Hola profee!!! Le queria dar gracias por su tiempo para enseñarnos!!!<br>Hace 13 años que vengo adeudando materias de matematica y gracias a sus videos la pude rendir!<br>Ahora voy por matematica de 3er año de aqui, Argentina!",kufA4JGm_sU,https://www.youtube.com/watch?v=kufA4JGm_sU
Justo me toca entrar a esta materia!!!  Muchas gracias!,kufA4JGm_sU,https://www.youtube.com/watch?v=kufA4JGm_sU
Gracias me ayuda mucho con sus videos 😁,kufA4JGm_sU,https://www.youtube.com/watch?v=kufA4JGm_sU
"Buen día profesor, quería preguntarle si tiene curso de límites?",kufA4JGm_sU,https://www.youtube.com/watch?v=kufA4JGm_sU
Muy bueno💞💞,kufA4JGm_sU,https://www.youtube.com/watch?v=kufA4JGm_sU
porque no hay una secuencia de sus clases de Ecuaciones Diferenciales?,0pR_tZAVnUE,https://www.youtube.com/watch?v=0pR_tZAVnUE
no se que seria de mi sin vos!!! excelente explicación profe,0pR_tZAVnUE,https://www.youtube.com/watch?v=0pR_tZAVnUE
"Gracias profe... Te admiro, eres incrieble explicando",0pR_tZAVnUE,https://www.youtube.com/watch?v=0pR_tZAVnUE
Un crack profesor...!!,0pR_tZAVnUE,https://www.youtube.com/watch?v=0pR_tZAVnUE
"gracias!! explica muy bien, al menos ahora ya no estoy tan perdida jeje",0pR_tZAVnUE,https://www.youtube.com/watch?v=0pR_tZAVnUE
K chévere!,0pR_tZAVnUE,https://www.youtube.com/watch?v=0pR_tZAVnUE
Un gran Profesor :3,0pR_tZAVnUE,https://www.youtube.com/watch?v=0pR_tZAVnUE
Grande profe Alex!! mucho respeto,0pR_tZAVnUE,https://www.youtube.com/watch?v=0pR_tZAVnUE
ERES UN GRANDE ENTRE LOS GRANDES PROFE ALEX!!!,0pR_tZAVnUE,https://www.youtube.com/watch?v=0pR_tZAVnUE
like,0pR_tZAVnUE,https://www.youtube.com/watch?v=0pR_tZAVnUE
ojala hubiera tenido un profesor asi,0pR_tZAVnUE,https://www.youtube.com/watch?v=0pR_tZAVnUE
Faltó la x del &quot;Dx&quot; no?,0pR_tZAVnUE,https://www.youtube.com/watch?v=0pR_tZAVnUE
"Hola mestro muy buenas noches, tengo una duda, no se como resolver la siguiente ecuacion diferencial: verificar si x=Csub1 e elevado a t + C sub 2 de la segunda derivada de x - la primera derivada de x . me piden buscar los valores de C sub1 y C sub2  si x(0) = 10 y x(0) derivada =100.",0pR_tZAVnUE,https://www.youtube.com/watch?v=0pR_tZAVnUE
Yo estoy haciendo una tarea de estadística y tengo que hacer una distribución de frecuencias <br>Estaba viendo sus vídeos pero yo tengo que hacer una distribución de frecuencias con un diagrama circular y con un pictograma por Favor me puede  ayudar,0pR_tZAVnUE,https://www.youtube.com/watch?v=0pR_tZAVnUE
"cuando te encanta las matemáticas y tienes un profesor como el profe alex ,que mas se puede pedir , gracias profe por seguir subiendo videos :) y que llege a los 10 millones :9",0pR_tZAVnUE,https://www.youtube.com/watch?v=0pR_tZAVnUE
Excelentes vídeos profe gracias!,0pR_tZAVnUE,https://www.youtube.com/watch?v=0pR_tZAVnUE
hola profe me podria ayudar en un polinomio porque me estoy  volviendo loco,0pR_tZAVnUE,https://www.youtube.com/watch?v=0pR_tZAVnUE
Profe suba un videos explicando las extensiones,0pR_tZAVnUE,https://www.youtube.com/watch?v=0pR_tZAVnUE
"Ayuda please con este problema, <br>Las diagonales de un trapecio son perpendiculares entre sí y miden 6 y 8. Halla el seno de x , sabiendo que x es el ángulo formado por la diagonal más pequeña y la base más grande del trapecio.",0pR_tZAVnUE,https://www.youtube.com/watch?v=0pR_tZAVnUE
muy buen video estoy en ecuaciones diferenciales en la escuela y si me es muy útil gracias <br>podría hacer uno de EDO exactas?? <br>Saludos,0pR_tZAVnUE,https://www.youtube.com/watch?v=0pR_tZAVnUE
Hola profe me podrías ayudar con esto  Indique las fracciones propias con denominador 28 (veintiochoavos) que se encuentran ubicadas en el rango <br>comprendido entre 11/16 y 27/32. No de cómo hacerla,0pR_tZAVnUE,https://www.youtube.com/watch?v=0pR_tZAVnUE
Genial muchas gracias saludos,0pR_tZAVnUE,https://www.youtube.com/watch?v=0pR_tZAVnUE
Puedes hacer un video sobre el teorema de euclides,0pR_tZAVnUE,https://www.youtube.com/watch?v=0pR_tZAVnUE
Hellouuuu,0pR_tZAVnUE,https://www.youtube.com/watch?v=0pR_tZAVnUE
"Profe me podría hacer el favor de explicarme las fracciones decimales? Sé que no está en el tema pero por favor, necesito su explicación para una exposición",0pR_tZAVnUE,https://www.youtube.com/watch?v=0pR_tZAVnUE
Aprendo mucho más que mi maestra de mate es vien exigente y voy aprendiendo poco a poco grasias soy nuevo en el canal,0pR_tZAVnUE,https://www.youtube.com/watch?v=0pR_tZAVnUE
Buen video profe a eso se llama amor a la profesión enseñas a personas desde youtube muy bueno 💪💪👌 que sigas creciendo profe alguien como tu necesita mas suscriptores porque subes contenido que vale la pena ver,0pR_tZAVnUE,https://www.youtube.com/watch?v=0pR_tZAVnUE
Wena profe,0pR_tZAVnUE,https://www.youtube.com/watch?v=0pR_tZAVnUE
Saludos profe gracias por el video eres el mejor !! ❤,0pR_tZAVnUE,https://www.youtube.com/watch?v=0pR_tZAVnUE
Me podría explicar la ley de los signos(me confundo) <br>Por ejemplo tengo<br> 3x-8x&gt;32-2 lo cuál sería<br>-5x&gt;30 <br>mi duda sería porque en 3x-8x sale negativo -5 y en 32-2 sale 30 positivo,0pR_tZAVnUE,https://www.youtube.com/watch?v=0pR_tZAVnUE
Porfa saludame en tu próximo video,0pR_tZAVnUE,https://www.youtube.com/watch?v=0pR_tZAVnUE
Hola,0pR_tZAVnUE,https://www.youtube.com/watch?v=0pR_tZAVnUE
Soy la primera,0pR_tZAVnUE,https://www.youtube.com/watch?v=0pR_tZAVnUE
En tu próximo video por favor me puedes saludar,0pR_tZAVnUE,https://www.youtube.com/watch?v=0pR_tZAVnUE
es literalmente el dios de las matemáticas,1_kJsHwf64c,https://www.youtube.com/watch?v=1_kJsHwf64c
"Un genio profesor me has ayudado en muchas clases y a entender muchos temas, sin duda usted tiene gran vocación en lo que hace, que Dios lo bendiga mucho y siga teniendo muchos éxitos, muchas gracias julioprofe",1_kJsHwf64c,https://www.youtube.com/watch?v=1_kJsHwf64c
"Cada vez que tengo que aprenderme un tema, primero paso por dónde el Profe Alex",1_kJsHwf64c,https://www.youtube.com/watch?v=1_kJsHwf64c
Muy buena explicacion profe se nota que tiene vocacion de profesor y que realmente sabe del tema,1_kJsHwf64c,https://www.youtube.com/watch?v=1_kJsHwf64c
Buen video,1_kJsHwf64c,https://www.youtube.com/watch?v=1_kJsHwf64c
"Super agradecido, estaba perdido en mis tareas, llevaba días sin entender nada, y ud explicando paso por paso, que uno no tiene que repetir el video y tampoco me quedó con las dudas del porque hizo los movimientos que hizo.",1_kJsHwf64c,https://www.youtube.com/watch?v=1_kJsHwf64c
"Excelente video! Una pregunta, has explicado ya la ecuación de Bernoulli? No la he entendido",1_kJsHwf64c,https://www.youtube.com/watch?v=1_kJsHwf64c
Usted profesor es un genio. Sus cursos son extremadamente ordenados. Subiendo poco a poco la dificultad a medida que avanzan los videos. Con eso consigue que nadie que haga el curso completo se pueda perder. Agradecido desde Chile y muchos saludos. Muy feliz por usted que cumplió los 4.000.000 de suscriptores y sumando.,1_kJsHwf64c,https://www.youtube.com/watch?v=1_kJsHwf64c
te amo,1_kJsHwf64c,https://www.youtube.com/watch?v=1_kJsHwf64c
"Profe Alex yo me estoy viendo todo su curso poque tengo que gacer un informe de 65 puntos y tambien porque por motivos de huracana en mi pais perdimos clases y ya el lic no nos pudo explicar entonces nos dejo este informe y nos pondra una prueba de que tenemos que haber aprendido espero salir bien, usted es el mejor",1_kJsHwf64c,https://www.youtube.com/watch?v=1_kJsHwf64c
"We neta, esas pequeñas explicaciones que haces son las que me hacen entender, muchas gracias",1_kJsHwf64c,https://www.youtube.com/watch?v=1_kJsHwf64c
lo tqm prof,1_kJsHwf64c,https://www.youtube.com/watch?v=1_kJsHwf64c
"buen video, que metodo uso cuando no son separables? espero me respondan, gracias.",1_kJsHwf64c,https://www.youtube.com/watch?v=1_kJsHwf64c
Excelente explicación,1_kJsHwf64c,https://www.youtube.com/watch?v=1_kJsHwf64c
"Buen dia. Excelente trabajo que realizan. Tengo una duda, ¿porqué dy/dx recibe un tratamiento de &quot;fracción&quot; cuando &quot;dy/dx&quot; es en realidad un operador diferencial? ¿cúando si y cuando no debemos darle un tratamiento de fraccion al operador diferencial de Leibniz? Saludos.",1_kJsHwf64c,https://www.youtube.com/watch?v=1_kJsHwf64c
En este caso puede verificar que ese resultado está bien remplazando?,1_kJsHwf64c,https://www.youtube.com/watch?v=1_kJsHwf64c
"Muy buen video, por cierto el ejercicio del final ya lo habia puesto en el video pasado &quot;ejemplo 3&quot;",1_kJsHwf64c,https://www.youtube.com/watch?v=1_kJsHwf64c
Gracias profe alex no se como sacaría mi carrera sin su ayuda es muy fácil de digerir todas sus clases,1_kJsHwf64c,https://www.youtube.com/watch?v=1_kJsHwf64c
"Muchas gracias profe!, he estado siguiendo el curso completo y pude realizar mis ejercicios de una manera muy fluida",1_kJsHwf64c,https://www.youtube.com/watch?v=1_kJsHwf64c
Gran explicación,1_kJsHwf64c,https://www.youtube.com/watch?v=1_kJsHwf64c
"En el minuto <a href=""https://www.youtube.com/watch?v=1_kJsHwf64c&amp;t=121"">2:01</a> sería Y*dx/ x , no? No y*dx/ dx<br>Te agradezco el curso, está excelente! Entendí lo que en 2 semanas de facultad me enseñaron mal, en 15 minutos!",1_kJsHwf64c,https://www.youtube.com/watch?v=1_kJsHwf64c
Interesante,1_kJsHwf64c,https://www.youtube.com/watch?v=1_kJsHwf64c
"Es un gran genio de las ecuaciones, ahora entiendo todo",1_kJsHwf64c,https://www.youtube.com/watch?v=1_kJsHwf64c
Buenísimo!!,1_kJsHwf64c,https://www.youtube.com/watch?v=1_kJsHwf64c
"Hola, me puedes ayudar con este ejercicio que no puedo aún resolverlo o no se que manera esta bien....<br>•) y. y&#39; - x= 0<br>1) <br>Y. dy/dx = x<br>Y. dy = x. dx<br>/y. dy= /x. dx<br>y./dy= /(x)dx (tomo &quot;y&quot; como constante) <br>Y.y=&gt; y^2 = (x^2)/2<br>Y= raiZ de(x^2/2)<br><br>2)<br>Y. dy/dx = x<br>Y. dy = x. dx<br>/y. dy= /x. dx (/ del integral en este caso) ( integre y y no lo tome como constante en el primer miembro)<br>Y^2/2= X^2/2<br>Y^2= x^2<br>Y= raiz(x^2)<br>Y= X<br><br>Estoy condundido si tomarlo o no dígame cual de los dos esta mal o si mal los dos.. Gracias!",1_kJsHwf64c,https://www.youtube.com/watch?v=1_kJsHwf64c
sobre ecuaciones diferenciales exactas estaría genial,1_kJsHwf64c,https://www.youtube.com/watch?v=1_kJsHwf64c
Hola profesor alex! Me gustaría saber si usted dispone de algún listado de temario para ver sus videos en orden y empezar aprendiendo desde lo más básico a lo más complejo! Quisiera ver todos los videos con un orden de aprendizaje! Gracias y buen trabajo!,1_kJsHwf64c,https://www.youtube.com/watch?v=1_kJsHwf64c
Buenos dias profe Como estas :vv,1_kJsHwf64c,https://www.youtube.com/watch?v=1_kJsHwf64c
Eres un crok,1_kJsHwf64c,https://www.youtube.com/watch?v=1_kJsHwf64c
Ecuaciones homogéneas profesor,1_kJsHwf64c,https://www.youtube.com/watch?v=1_kJsHwf64c
Hola profesor Alex me puede ayudar a resolver este ejercicio por favor y gracias  2-[7-(8-2)+(12+7)]-(-14),1_kJsHwf64c,https://www.youtube.com/watch?v=1_kJsHwf64c
Profe ejercicios más difíciles resuelve,1_kJsHwf64c,https://www.youtube.com/watch?v=1_kJsHwf64c
Necesito saber cómo son las fracciones con los números naturales,1_kJsHwf64c,https://www.youtube.com/watch?v=1_kJsHwf64c
Yo y mi abuela te adoramos feliz dia/!!,1_kJsHwf64c,https://www.youtube.com/watch?v=1_kJsHwf64c
Me ayudaste muchísimo en las fracciones,1_kJsHwf64c,https://www.youtube.com/watch?v=1_kJsHwf64c
Sos un genio en 8 min entendí todo lo de una semana,1_kJsHwf64c,https://www.youtube.com/watch?v=1_kJsHwf64c
Profeee,1_kJsHwf64c,https://www.youtube.com/watch?v=1_kJsHwf64c
Ojala me tocara con el profe Alex garsias profe por sus enseñansas!!! :),1_kJsHwf64c,https://www.youtube.com/watch?v=1_kJsHwf64c
gracias por  la información,1_kJsHwf64c,https://www.youtube.com/watch?v=1_kJsHwf64c
