Comment,VideoId,VideoUrl
"Hola profe  alex, queria consultarle la razón del porque se deriva 2 veces o más. Ya estuve en su curso de derivadas y me sirvio de mucho, pero me surgio la duda, de por que se deben derivar más de una vez.",_GW79tPHmVA,https://www.youtube.com/watch?v=_GW79tPHmVA
"bien explicado, se agradece",_GW79tPHmVA,https://www.youtube.com/watch?v=_GW79tPHmVA
Muchas gracias profe. -+10,_GW79tPHmVA,https://www.youtube.com/watch?v=_GW79tPHmVA
"me encanta su forma de explicar, saludos!",_GW79tPHmVA,https://www.youtube.com/watch?v=_GW79tPHmVA
Es el mejor...saludos,_GW79tPHmVA,https://www.youtube.com/watch?v=_GW79tPHmVA
"Muchas Gracias Profesor por fin entendí,  cosa que en las clases virtuales por la cuarentena no se puede entender.",_GW79tPHmVA,https://www.youtube.com/watch?v=_GW79tPHmVA
"Muchas gracias por los videos, profe. Voy a ver todo el curso. Ahora con el coronavirus y las clases online, casi no estoy entendiendo la tarea que me dejaron en la universidad. Muchas gracias otra vez",_GW79tPHmVA,https://www.youtube.com/watch?v=_GW79tPHmVA
"El mejor explicando, muchas gracias profesor  &lt;3",_GW79tPHmVA,https://www.youtube.com/watch?v=_GW79tPHmVA
Like si el profe Alex es un Dios,_GW79tPHmVA,https://www.youtube.com/watch?v=_GW79tPHmVA
Mis respetos Profe !,_GW79tPHmVA,https://www.youtube.com/watch?v=_GW79tPHmVA
Me estás salvando de una semana que no entendí la clase. Se logra el final :&#39;v,_GW79tPHmVA,https://www.youtube.com/watch?v=_GW79tPHmVA
Que bien video profe :),_GW79tPHmVA,https://www.youtube.com/watch?v=_GW79tPHmVA
Excelente explicacion.... Me suscribo enseguida.....,_GW79tPHmVA,https://www.youtube.com/watch?v=_GW79tPHmVA
"Profesor. En el min <a href=""https://www.youtube.com/watch?v=_GW79tPHmVA&amp;t=445"">7:25</a> no sería el seno de la variable independiente y no de la dependiente Y.??. Eso me explicaron en clases. Por el resto muy bien. Saludos. Y espero conteste mi duda.",_GW79tPHmVA,https://www.youtube.com/watch?v=_GW79tPHmVA
Te amo,_GW79tPHmVA,https://www.youtube.com/watch?v=_GW79tPHmVA
Profe puedo ir al baño?,_GW79tPHmVA,https://www.youtube.com/watch?v=_GW79tPHmVA
Gracias por tu gran trabajo profesor,_GW79tPHmVA,https://www.youtube.com/watch?v=_GW79tPHmVA
Presente profe,_GW79tPHmVA,https://www.youtube.com/watch?v=_GW79tPHmVA
Sos realmente un genio,_GW79tPHmVA,https://www.youtube.com/watch?v=_GW79tPHmVA
Profe puedo ir al baño?,_GW79tPHmVA,https://www.youtube.com/watch?v=_GW79tPHmVA
"Haber yo vine por una osacion,que mi profesora me dijo que buscara a este profesor 😅",_GW79tPHmVA,https://www.youtube.com/watch?v=_GW79tPHmVA
No entendi,_GW79tPHmVA,https://www.youtube.com/watch?v=_GW79tPHmVA
Broooooooooooooooooooooooooooooooooooooooooooooooooooooooooooooooooooooooooooooooooooooooooooooooooooooooooooooooooooooooooooooooooooooooooooooooo,_GW79tPHmVA,https://www.youtube.com/watch?v=_GW79tPHmVA
El explica mejor le entiendo a la primera😧💙estoy amando los números 😆,_GW79tPHmVA,https://www.youtube.com/watch?v=_GW79tPHmVA
Gracias profe,_GW79tPHmVA,https://www.youtube.com/watch?v=_GW79tPHmVA
muy bueno saludos,_GW79tPHmVA,https://www.youtube.com/watch?v=_GW79tPHmVA
"Hola Profesor Alex quiero si me puedes ayudar en una tarea de matemáticas y ve a este link <a href=""https://brainly.lat/tarea/12788073"">https://brainly.lat/tarea/12788073</a>",_GW79tPHmVA,https://www.youtube.com/watch?v=_GW79tPHmVA
El metodo del jauss,_GW79tPHmVA,https://www.youtube.com/watch?v=_GW79tPHmVA
hola pofe muchas gracias x difundir sus conocimientos,_GW79tPHmVA,https://www.youtube.com/watch?v=_GW79tPHmVA
"Profesor Alex,de que país eres?",_GW79tPHmVA,https://www.youtube.com/watch?v=_GW79tPHmVA
like si el profe alex es mejor que el de la escuela,_GW79tPHmVA,https://www.youtube.com/watch?v=_GW79tPHmVA
"Ya Espero por toda la lista de ecuaciones, hoy tuve mi primer examen y espero mejorar la siguiente oportunidad :c",_GW79tPHmVA,https://www.youtube.com/watch?v=_GW79tPHmVA
"Profe Alex me da mucho gusto que siga haciendo vídeos de YouTube para los que quieren aprender matemáticas (obviamente me estoy incluyendo) y para todos aquellos que ya saben y están viendo esto vídeos para reforzar más lo ya aprendido, saludos.",_GW79tPHmVA,https://www.youtube.com/watch?v=_GW79tPHmVA
chido,_GW79tPHmVA,https://www.youtube.com/watch?v=_GW79tPHmVA
Grax profe Ud. Es el único q xplica mejor 👍,_GW79tPHmVA,https://www.youtube.com/watch?v=_GW79tPHmVA
"Lo mas importante es que no importa cuan avanzado sea el tema, pues siempre hace un repaso de los conceptos primordiales para que el estudiante sr mantenga actualizado y no tenga que poner su pensamiento a viajar al pasado para nutrirse 👍",_GW79tPHmVA,https://www.youtube.com/watch?v=_GW79tPHmVA
Profe Alex saludame veo todos tus vídeos y estoy subcrito a su canal,_GW79tPHmVA,https://www.youtube.com/watch?v=_GW79tPHmVA
Yo soy profesora y aprendí mucho del Profesor Alex por eso sigo suscrita porque es el único en todo youtube que explica mejor!!,_GW79tPHmVA,https://www.youtube.com/watch?v=_GW79tPHmVA
"Ahora sí voy a necesitar un chingo tus vídeos que bueno que existes wey eres la vrga :,v",_GW79tPHmVA,https://www.youtube.com/watch?v=_GW79tPHmVA
Saludos profe :D,_GW79tPHmVA,https://www.youtube.com/watch?v=_GW79tPHmVA
Saque 10 en matemáticas gracias a usted,_GW79tPHmVA,https://www.youtube.com/watch?v=_GW79tPHmVA
hola me podría ayudar en un problema de trigonometría por favor,_GW79tPHmVA,https://www.youtube.com/watch?v=_GW79tPHmVA
"Muy Bien ,  Bendiciones  desde Peru👍👍👍👍👍👍✔✔✔✔✔✔✌✌✌✌❤❤❤❤❤❤❤",_GW79tPHmVA,https://www.youtube.com/watch?v=_GW79tPHmVA
Saludos Profe Alex :) aprendo mucho con sus videos.,_GW79tPHmVA,https://www.youtube.com/watch?v=_GW79tPHmVA
Si tengo alguna ves dudas me ayudaras por que ya me va a tocar matemáticas y uu,_GW79tPHmVA,https://www.youtube.com/watch?v=_GW79tPHmVA
Presente!!,_GW79tPHmVA,https://www.youtube.com/watch?v=_GW79tPHmVA
Gracias me sirvio de mucho :D,_GW79tPHmVA,https://www.youtube.com/watch?v=_GW79tPHmVA
Graaacias :),NYE1GhhiF7E,https://www.youtube.com/watch?v=NYE1GhhiF7E
"Excelentes videos, son de gran ayuda. 😊 algún libro que me pueda recomendar ?",NYE1GhhiF7E,https://www.youtube.com/watch?v=NYE1GhhiF7E
Gracias por sus videos con este ya es la tercera vez que repito ecuaciones diferenciales,NYE1GhhiF7E,https://www.youtube.com/watch?v=NYE1GhhiF7E
"Poco a poco ya le voy entendiendo, GRACIAS PROFE!!!!",NYE1GhhiF7E,https://www.youtube.com/watch?v=NYE1GhhiF7E
Gracias por existir profe Alex,NYE1GhhiF7E,https://www.youtube.com/watch?v=NYE1GhhiF7E
excelente,NYE1GhhiF7E,https://www.youtube.com/watch?v=NYE1GhhiF7E
Excelente Prof... que bien... comprendido  a la perfeccion,NYE1GhhiF7E,https://www.youtube.com/watch?v=NYE1GhhiF7E
"Muy buena explicación, muchas gracias. 🤗",NYE1GhhiF7E,https://www.youtube.com/watch?v=NYE1GhhiF7E
Que grande,NYE1GhhiF7E,https://www.youtube.com/watch?v=NYE1GhhiF7E
"Muchas gracias, estoy aqui tomando todo el curso porque tengo demaciado tiempo libre y esto me ayuda a pasar el tiempo e irme preparando para el proximo semestre 😁",NYE1GhhiF7E,https://www.youtube.com/watch?v=NYE1GhhiF7E
Muy buen nivel.,NYE1GhhiF7E,https://www.youtube.com/watch?v=NYE1GhhiF7E
"maestro de maestros profe alex, le agradesco",NYE1GhhiF7E,https://www.youtube.com/watch?v=NYE1GhhiF7E
Gracias profe,NYE1GhhiF7E,https://www.youtube.com/watch?v=NYE1GhhiF7E
Fantásticas sus explicaciones. Gracias,NYE1GhhiF7E,https://www.youtube.com/watch?v=NYE1GhhiF7E
Demasiado útil. Muchas gracias.,NYE1GhhiF7E,https://www.youtube.com/watch?v=NYE1GhhiF7E
como le explico que estoy rindiendo analisis matematico con solamente videos tuyos?,NYE1GhhiF7E,https://www.youtube.com/watch?v=NYE1GhhiF7E
❤️ Es el mejor ❤️,NYE1GhhiF7E,https://www.youtube.com/watch?v=NYE1GhhiF7E
excelente como siempre profee :),NYE1GhhiF7E,https://www.youtube.com/watch?v=NYE1GhhiF7E
El mejor!!!!,NYE1GhhiF7E,https://www.youtube.com/watch?v=NYE1GhhiF7E
El que sabe sabe 🙌😌❤️,NYE1GhhiF7E,https://www.youtube.com/watch?v=NYE1GhhiF7E
Gracias profe justo hoy empecé mi curso de ecuaciones diferenciales.,NYE1GhhiF7E,https://www.youtube.com/watch?v=NYE1GhhiF7E
"excelente, muchísimas gracias!",NYE1GhhiF7E,https://www.youtube.com/watch?v=NYE1GhhiF7E
vine buscando cobre y encontré oro!,NYE1GhhiF7E,https://www.youtube.com/watch?v=NYE1GhhiF7E
"excelente pedagogìa, el mejor profe",NYE1GhhiF7E,https://www.youtube.com/watch?v=NYE1GhhiF7E
"Sin duda de los mejores profesores, deberia hacer un curso de Algebra Lineal",NYE1GhhiF7E,https://www.youtube.com/watch?v=NYE1GhhiF7E
explica lo que en los libros lamentablemente pasan por alto. muchas gracias,NYE1GhhiF7E,https://www.youtube.com/watch?v=NYE1GhhiF7E
"El mejor!!!!! <br>Hoy fue mi primera clase de manera virtual, tenia pésimo mi conexión a internet, y las aplicaciones usadas para recibir la clase no eran las mas optimas, por eso me desanime ya comenzando semestre; pero encontré estos videos y gracias a Dios ya me puse en contexto para asi poder entender lo maravilloso que son las ecuaciones diferenciales. GRACIAS PROFE ALEX, saludos desde Colombia.",NYE1GhhiF7E,https://www.youtube.com/watch?v=NYE1GhhiF7E
"Gracias profe ! en verdad ayudan muchísimos sus videos, de verdad gracias !!!!!!",NYE1GhhiF7E,https://www.youtube.com/watch?v=NYE1GhhiF7E
Que gran profesor,NYE1GhhiF7E,https://www.youtube.com/watch?v=NYE1GhhiF7E
Excelente video profesor gracias,NYE1GhhiF7E,https://www.youtube.com/watch?v=NYE1GhhiF7E
GRACIAS A ESTE HOMBRE HE PODIDO PASAR CALCULO,NYE1GhhiF7E,https://www.youtube.com/watch?v=NYE1GhhiF7E
un crack!!,NYE1GhhiF7E,https://www.youtube.com/watch?v=NYE1GhhiF7E
"Profe, buenos videos.<br>Gracias a ellos aprendí a integrar y nunca tuve dificultades en el curso.",NYE1GhhiF7E,https://www.youtube.com/watch?v=NYE1GhhiF7E
Estoy aquí porque no quiero llegar sin saber nada en mi próximo cuatrimestre. Me estoy adelantando :),NYE1GhhiF7E,https://www.youtube.com/watch?v=NYE1GhhiF7E
Y para qué gradó es esta cosa?,NYE1GhhiF7E,https://www.youtube.com/watch?v=NYE1GhhiF7E
"Hola profe, como siempre el mejor en sus explicaciones... sólo un detalle, por sus comentarios en este video y el &quot;anterior&quot; creo que los acomodó mal, éste debe ser el video 2 y el de orden de una ecuación diferencial debe ser el tres... saludos !!",NYE1GhhiF7E,https://www.youtube.com/watch?v=NYE1GhhiF7E
"profe hay un ejercicio que no entiendo, puede buscarlo y explicarlo por favor: Problema: En la teoría del aprendizaje, se supone que la rapidez con que se memoriza algo es proporcional a la cantidad de datos por memorizar, suponga que M representa la cantidad total de un tema que se debe memorizar y que A(t) es la cantidad memorizada cuando el tiempo es t, Cual es la ecuación diferencial que expresa y la solución para determinar la cantidad A(t) para cualquier t. En el caso de mi respuesta dan 5 opciones a,b,c,d,e y por alumno debemos tomar 1 opcion y comprobarla",NYE1GhhiF7E,https://www.youtube.com/watch?v=NYE1GhhiF7E
Espectacular. Consulta que serie de videos me recomiendas para prepararme para econometria? Muchísimas gracias!,NYE1GhhiF7E,https://www.youtube.com/watch?v=NYE1GhhiF7E
Muy padre y todo pero como pinches se resuelven -_-,NYE1GhhiF7E,https://www.youtube.com/watch?v=NYE1GhhiF7E
El mejor!!!!,NYE1GhhiF7E,https://www.youtube.com/watch?v=NYE1GhhiF7E
"Mil gracias profe, la verdad estoy en noveno semestre de matematicas y gracias a su trabajo he podido aprender sin ningún problema, ya pronto tendré mi titulo de licenciado de la UNAD y en gran parte se lo debo a usted, saludos desde el limón, chaparral Tolima.",NYE1GhhiF7E,https://www.youtube.com/watch?v=NYE1GhhiF7E
usted es mucho mejor que mi profesor,NYE1GhhiF7E,https://www.youtube.com/watch?v=NYE1GhhiF7E
Muy bien explicando 👌👌,NYE1GhhiF7E,https://www.youtube.com/watch?v=NYE1GhhiF7E
Hola profesor!!<br>Me preguntaba si podía hacerme un favor:<br>Podría hacer un vídeo sobre las &quot;convenciones de un sistema a otro&quot;.<br><br>No le entendí muy bien y me preguntaba si podía  explicarme.<br>Espero que no le moleste.,NYE1GhhiF7E,https://www.youtube.com/watch?v=NYE1GhhiF7E
"Hola, me podría ayudar con éste ejercicio?<br><br><br>Un hijo tiene 5 años y su padre 25 años y su madre 25 años, ahora su edad equivale a 1/5 de cada uno de ellos ¿Cuántos años han de pasar para que la edad del hijo sea 1/2 de la suma de las edades de ambos padres?",NYE1GhhiF7E,https://www.youtube.com/watch?v=NYE1GhhiF7E
Profe sabes como sacar el volumen de un cuerpo de revolución,NYE1GhhiF7E,https://www.youtube.com/watch?v=NYE1GhhiF7E
Graciaas profe. Saludos,NYE1GhhiF7E,https://www.youtube.com/watch?v=NYE1GhhiF7E
Profee suba videos sobre tecnicas de conteo porfavor,NYE1GhhiF7E,https://www.youtube.com/watch?v=NYE1GhhiF7E
Hola gracias profesor!!!,NYE1GhhiF7E,https://www.youtube.com/watch?v=NYE1GhhiF7E
Eso me enseñaran en el prepa<br>Y gracias  por enseñarme es que en tercero <br>no entendia pero gracias,NYE1GhhiF7E,https://www.youtube.com/watch?v=NYE1GhhiF7E
Un profe así porfa🙏<br>El mío no me gusta para nada <br>Like sino te gusta tu profe de mates y prefieres a este 🙊,NYE1GhhiF7E,https://www.youtube.com/watch?v=NYE1GhhiF7E
Gracias!👏👏,NYE1GhhiF7E,https://www.youtube.com/watch?v=NYE1GhhiF7E
La verdad es que la notación de leibneiz es la mejor,NYE1GhhiF7E,https://www.youtube.com/watch?v=NYE1GhhiF7E
"Bueno, noveno comentario, gracia profe Alex por ayudarme a pasar calculo y ecuaciones",NYE1GhhiF7E,https://www.youtube.com/watch?v=NYE1GhhiF7E
ereѕ él мejor proғeѕor,NYE1GhhiF7E,https://www.youtube.com/watch?v=NYE1GhhiF7E
Llegué un poco tarde pero siempre pendiente,NYE1GhhiF7E,https://www.youtube.com/watch?v=NYE1GhhiF7E
"Ufffff que bien profe, gracias de nuevo, voy a empezar este curso en la U. Saludos desde Cúcuta!",NYE1GhhiF7E,https://www.youtube.com/watch?v=NYE1GhhiF7E
Video muy interesante mi profesora siempre en la compu pone tus videos y aprendemos de ello muchas gracias,NYE1GhhiF7E,https://www.youtube.com/watch?v=NYE1GhhiF7E
una visita 9 likes xd,NYE1GhhiF7E,https://www.youtube.com/watch?v=NYE1GhhiF7E
Llegue temprano :v,NYE1GhhiF7E,https://www.youtube.com/watch?v=NYE1GhhiF7E
sigo siendo primero xd,NYE1GhhiF7E,https://www.youtube.com/watch?v=NYE1GhhiF7E
primero,NYE1GhhiF7E,https://www.youtube.com/watch?v=NYE1GhhiF7E
Graciass,j1nwW8eyD0Q,https://www.youtube.com/watch?v=j1nwW8eyD0Q
Grandeeee gracias,j1nwW8eyD0Q,https://www.youtube.com/watch?v=j1nwW8eyD0Q
Agradecido,j1nwW8eyD0Q,https://www.youtube.com/watch?v=j1nwW8eyD0Q
"Gracias a usted entré a la uni, y aún dentro me sigue ayudando con sus videos, muchas gracias y larga vida al profe Alex 🙏🙏🙏",j1nwW8eyD0Q,https://www.youtube.com/watch?v=j1nwW8eyD0Q
Gracias profe,j1nwW8eyD0Q,https://www.youtube.com/watch?v=j1nwW8eyD0Q
Gracias profe 🔥😎🔥,j1nwW8eyD0Q,https://www.youtube.com/watch?v=j1nwW8eyD0Q
Explixa muy bien gracias prof Alex🎉,j1nwW8eyD0Q,https://www.youtube.com/watch?v=j1nwW8eyD0Q
Cuales son las E.D  exactas  o inexactas?,j1nwW8eyD0Q,https://www.youtube.com/watch?v=j1nwW8eyD0Q
EXCELENTE VIDEO!!,j1nwW8eyD0Q,https://www.youtube.com/watch?v=j1nwW8eyD0Q
Grande profe,j1nwW8eyD0Q,https://www.youtube.com/watch?v=j1nwW8eyD0Q
"disculpe, es lo mismo decir ecuación  lineal o grado 1?",j1nwW8eyD0Q,https://www.youtube.com/watch?v=j1nwW8eyD0Q
Muchas gracias profe. Saludos desde Colombia,j1nwW8eyD0Q,https://www.youtube.com/watch?v=j1nwW8eyD0Q
"Gracias profe Alex, la única forma que tengo para pagarle es:<br><br>* pedirle bendiciones a Dios para usted<br>* dar like y <br>* dejar correr los anuncios.",j1nwW8eyD0Q,https://www.youtube.com/watch?v=j1nwW8eyD0Q
Estoy estudiando ingeniería y estos videos me ayudan mucho. Gracias profe Alex. GOOD VIBES,j1nwW8eyD0Q,https://www.youtube.com/watch?v=j1nwW8eyD0Q
Gracias profe bendiciones.,j1nwW8eyD0Q,https://www.youtube.com/watch?v=j1nwW8eyD0Q
Super agradecida de su canal! estaba en la ultima oportunidad de mi examen y usted me hizo un parote con este vídeo.,j1nwW8eyD0Q,https://www.youtube.com/watch?v=j1nwW8eyD0Q
Gracias!!,j1nwW8eyD0Q,https://www.youtube.com/watch?v=j1nwW8eyD0Q
Que bibliografía utiliza profe Alex?,j1nwW8eyD0Q,https://www.youtube.com/watch?v=j1nwW8eyD0Q
Profe yo lo amo.,j1nwW8eyD0Q,https://www.youtube.com/watch?v=j1nwW8eyD0Q
"en el minuto <a href=""https://www.youtube.com/watch?v=j1nwW8eyD0Q&amp;t=1029"">17:09</a> la y´ esta siendo multiplicada por Sen, ya que Sen(x) donde (x) es un Angulo y no una letra. por tanto esa ecuación diferencial no es lineal por que esta siendo multiplicada por Seno y no por x como plantea el profe o ¿estoy equivocado?",j1nwW8eyD0Q,https://www.youtube.com/watch?v=j1nwW8eyD0Q
Excelente,j1nwW8eyD0Q,https://www.youtube.com/watch?v=j1nwW8eyD0Q
"Siempre busco sus videos porque me ayudan a tener una mejor comprension de los  temas. Muchas gracias. Bendiciones. <a href=""UCkszU2WH9gy1mb0dV-11UJg/JAJ1XpGpJYnW8wTupZu4Cw""></a>👏🤝",j1nwW8eyD0Q,https://www.youtube.com/watch?v=j1nwW8eyD0Q
Muchas gracias❤,j1nwW8eyD0Q,https://www.youtube.com/watch?v=j1nwW8eyD0Q
"buen video, entendi a la perfeccion",j1nwW8eyD0Q,https://www.youtube.com/watch?v=j1nwW8eyD0Q
Mil gracias.<br><br>Saludos desde Colombia,j1nwW8eyD0Q,https://www.youtube.com/watch?v=j1nwW8eyD0Q
"Esto parece Japones, jajajaja no se porque me hizo tanta gracia. muy buen video profe!!!!!!!!",j1nwW8eyD0Q,https://www.youtube.com/watch?v=j1nwW8eyD0Q
Genial explicación!,j1nwW8eyD0Q,https://www.youtube.com/watch?v=j1nwW8eyD0Q
Muchas gracias profe :),j1nwW8eyD0Q,https://www.youtube.com/watch?v=j1nwW8eyD0Q
El mejor de todos.,j1nwW8eyD0Q,https://www.youtube.com/watch?v=j1nwW8eyD0Q
Quedó súper clarooo profe gracias!!!,j1nwW8eyD0Q,https://www.youtube.com/watch?v=j1nwW8eyD0Q
"Gracias maestro, lo kiero",j1nwW8eyD0Q,https://www.youtube.com/watch?v=j1nwW8eyD0Q
Lo que no aprendí en 2 semanas lo aprendí en 20 minutos<br>Muchas gracias nuevo sub 👍,j1nwW8eyD0Q,https://www.youtube.com/watch?v=j1nwW8eyD0Q
"Excelente explicación, muchas gracias",j1nwW8eyD0Q,https://www.youtube.com/watch?v=j1nwW8eyD0Q
"Profe Alex, usted es lo MAXIMO!!! MIL GRACIAS",j1nwW8eyD0Q,https://www.youtube.com/watch?v=j1nwW8eyD0Q
Profe haga un video de sistema de escuaciones No lineales por favor,j1nwW8eyD0Q,https://www.youtube.com/watch?v=j1nwW8eyD0Q
Excelente su explicación y gracias por tomarte un tiempo. Por favor sube más videos.,j1nwW8eyD0Q,https://www.youtube.com/watch?v=j1nwW8eyD0Q
"Profe, por usted le hecho ganas a la universidad, gracias &lt;3",j1nwW8eyD0Q,https://www.youtube.com/watch?v=j1nwW8eyD0Q
señor lo amo gracias.,j1nwW8eyD0Q,https://www.youtube.com/watch?v=j1nwW8eyD0Q
"Profe Alex, desde mas de un año veo sus videos, tenía mas de 2 millones de suscriptores, ahora tiene el doble en tan solo un poco mas de un año, que increíble. Muchas gracias por tanta calidad",j1nwW8eyD0Q,https://www.youtube.com/watch?v=j1nwW8eyD0Q
Te amo :(,j1nwW8eyD0Q,https://www.youtube.com/watch?v=j1nwW8eyD0Q
Ecuaciones diferenciales es lo mismo que Calculo diferencial?🔥✌,j1nwW8eyD0Q,https://www.youtube.com/watch?v=j1nwW8eyD0Q
Esto vale oro,j1nwW8eyD0Q,https://www.youtube.com/watch?v=j1nwW8eyD0Q
"Excelente video, muchas gracias!",j1nwW8eyD0Q,https://www.youtube.com/watch?v=j1nwW8eyD0Q
respeto al maestro,j1nwW8eyD0Q,https://www.youtube.com/watch?v=j1nwW8eyD0Q
El mejor profesor del mundo,j1nwW8eyD0Q,https://www.youtube.com/watch?v=j1nwW8eyD0Q
"Muchas gracias profe, excelente video.",j1nwW8eyD0Q,https://www.youtube.com/watch?v=j1nwW8eyD0Q
excelente,j1nwW8eyD0Q,https://www.youtube.com/watch?v=j1nwW8eyD0Q
"Gracias Profe Alex, me ayuda a salvar el semestre",j1nwW8eyD0Q,https://www.youtube.com/watch?v=j1nwW8eyD0Q
lo minimo que puedo hacer es ver los comerciales completos para poder agradecerle profe jsjsjs gracias,j1nwW8eyD0Q,https://www.youtube.com/watch?v=j1nwW8eyD0Q
¡Muchas Gracias Profesor!,j1nwW8eyD0Q,https://www.youtube.com/watch?v=j1nwW8eyD0Q
"Están geniales tus videos, además de bien editados y explicados se escuchan muy bien :D<br>Gracias por su esfuerzo.",j1nwW8eyD0Q,https://www.youtube.com/watch?v=j1nwW8eyD0Q
"Gracias Profe, para mi usted es el mejor❤❤❤❤❤❤❤ Dios me le de aun mas sabiduria😊❤❤",j1nwW8eyD0Q,https://www.youtube.com/watch?v=j1nwW8eyD0Q
"Muchas muchas gracias, solo aquí pude entender por completo lo que era una E.D lineal",j1nwW8eyD0Q,https://www.youtube.com/watch?v=j1nwW8eyD0Q
"Alabado sea Profe Alex, siempre lo llevaré en mi corazón",j1nwW8eyD0Q,https://www.youtube.com/watch?v=j1nwW8eyD0Q
Hola profe. Ecuaciones diferenciales es lo mismo que calculo diferencial?,j1nwW8eyD0Q,https://www.youtube.com/watch?v=j1nwW8eyD0Q
eres un astro mi rey,j1nwW8eyD0Q,https://www.youtube.com/watch?v=j1nwW8eyD0Q
"Muchísimas gracias por los videos que realiza, siempre me saca de apuros cuando no entiendo un tema simplemente se me olvidad detalles para realizar algún tipo de problema, excelente videos como siempre, un saludo!!",j1nwW8eyD0Q,https://www.youtube.com/watch?v=j1nwW8eyD0Q
Excelente video profe!! gracias,j1nwW8eyD0Q,https://www.youtube.com/watch?v=j1nwW8eyD0Q
"muy buena explicación ,muchas gracias me sirvió mucho",j1nwW8eyD0Q,https://www.youtube.com/watch?v=j1nwW8eyD0Q
Excelente explicación.Muchas gracias!!!!,j1nwW8eyD0Q,https://www.youtube.com/watch?v=j1nwW8eyD0Q
Profe Alex casese conmigo!!! Gracias por siempre ayudarnos lo amo &lt;3,j1nwW8eyD0Q,https://www.youtube.com/watch?v=j1nwW8eyD0Q
Clarísimo el concepto con todos los ejemplos que puso,j1nwW8eyD0Q,https://www.youtube.com/watch?v=j1nwW8eyD0Q
"Resolvió todas mis dudas, gracias",j1nwW8eyD0Q,https://www.youtube.com/watch?v=j1nwW8eyD0Q
gracias!! explicas muy bien! :D,j1nwW8eyD0Q,https://www.youtube.com/watch?v=j1nwW8eyD0Q
Exelente explicación.  Se entiende a la perfeccón Gracias prof Alex,j1nwW8eyD0Q,https://www.youtube.com/watch?v=j1nwW8eyD0Q
YT debería dar la opcion de velocidad x 3 ... :&quot;(,j1nwW8eyD0Q,https://www.youtube.com/watch?v=j1nwW8eyD0Q
"Profe, salvaste mi vida 😙",j1nwW8eyD0Q,https://www.youtube.com/watch?v=j1nwW8eyD0Q
"Estaria bien si abarcara todo el curso de ecuaciones diferenciasles, como transformada de laplace etc.",j1nwW8eyD0Q,https://www.youtube.com/watch?v=j1nwW8eyD0Q
"Ganaste un suscriptor, excelente explicación.",j1nwW8eyD0Q,https://www.youtube.com/watch?v=j1nwW8eyD0Q
Si funciona,j1nwW8eyD0Q,https://www.youtube.com/watch?v=j1nwW8eyD0Q
"Gracias por existir, profe Alex",j1nwW8eyD0Q,https://www.youtube.com/watch?v=j1nwW8eyD0Q
Muy bien explicado ! Gracias !,j1nwW8eyD0Q,https://www.youtube.com/watch?v=j1nwW8eyD0Q
El mejor Profesor... Saludos,j1nwW8eyD0Q,https://www.youtube.com/watch?v=j1nwW8eyD0Q
Graciiias por todo! 💛,j1nwW8eyD0Q,https://www.youtube.com/watch?v=j1nwW8eyD0Q
el profe alex es el mejor,j1nwW8eyD0Q,https://www.youtube.com/watch?v=j1nwW8eyD0Q
"Mi profe hizo lo mismo pero no le entendi nadaa :´v, pero profe Alex, a usted si se le entiendo, buen video",j1nwW8eyD0Q,https://www.youtube.com/watch?v=j1nwW8eyD0Q
Graciaaaaas,j1nwW8eyD0Q,https://www.youtube.com/watch?v=j1nwW8eyD0Q
Explica demasiado bien,j1nwW8eyD0Q,https://www.youtube.com/watch?v=j1nwW8eyD0Q
"Buenas noches profe Alex. Excelente el curso de ecuaciones diferencial. Podria también por favor explicar sobre las ecuaciones diferenciales exactas y no exactas, ecuaciones lineales de primer orden? Le voy a agradecer muchísimo.",j1nwW8eyD0Q,https://www.youtube.com/watch?v=j1nwW8eyD0Q
gracias profe Alex,j1nwW8eyD0Q,https://www.youtube.com/watch?v=j1nwW8eyD0Q
!Excelente vídeo¡,j1nwW8eyD0Q,https://www.youtube.com/watch?v=j1nwW8eyD0Q
"Escuchar su explicación es como escuchar los ángeles cantando y salvandome de la universidad, gracias  por existir  Profe !!",j1nwW8eyD0Q,https://www.youtube.com/watch?v=j1nwW8eyD0Q
"Explicas super bien, profe Alex.",j1nwW8eyD0Q,https://www.youtube.com/watch?v=j1nwW8eyD0Q
Excelente clase profesor...oro puro en conocimiento!!!!,j1nwW8eyD0Q,https://www.youtube.com/watch?v=j1nwW8eyD0Q
"Excelente vídeo, me quedo claro el tema, muchas gracias. Nuevo suscriptor.",j1nwW8eyD0Q,https://www.youtube.com/watch?v=j1nwW8eyD0Q
Excelente.,j1nwW8eyD0Q,https://www.youtube.com/watch?v=j1nwW8eyD0Q
"Muchas gracias, profesor. <br>Me sirvió de mucho su explicación y sus ejemplos!",j1nwW8eyD0Q,https://www.youtube.com/watch?v=j1nwW8eyD0Q
GRACIAS PROFE ALEX!,j1nwW8eyD0Q,https://www.youtube.com/watch?v=j1nwW8eyD0Q
De gran ayuda!!!,j1nwW8eyD0Q,https://www.youtube.com/watch?v=j1nwW8eyD0Q
gracias,j1nwW8eyD0Q,https://www.youtube.com/watch?v=j1nwW8eyD0Q
"siempre daré like, este es un gran canal con un excelente profesor",j1nwW8eyD0Q,https://www.youtube.com/watch?v=j1nwW8eyD0Q
"Gracias profe, estoy adelantando clases de la U y me hizo entender fácil el tema",j1nwW8eyD0Q,https://www.youtube.com/watch?v=j1nwW8eyD0Q
Que man tan crack,j1nwW8eyD0Q,https://www.youtube.com/watch?v=j1nwW8eyD0Q
Maratón de ecuaciones diferenciales?,j1nwW8eyD0Q,https://www.youtube.com/watch?v=j1nwW8eyD0Q
Excelente video 🔝,j1nwW8eyD0Q,https://www.youtube.com/watch?v=j1nwW8eyD0Q
Si mi variable dependiente es &quot;y&quot; y tengo &quot;ylogy&quot; no es lineal?,j1nwW8eyD0Q,https://www.youtube.com/watch?v=j1nwW8eyD0Q
DIOS LO BENDIGA GRANDEMENTE :3,j1nwW8eyD0Q,https://www.youtube.com/watch?v=j1nwW8eyD0Q
Excelente contenido..!!,j1nwW8eyD0Q,https://www.youtube.com/watch?v=j1nwW8eyD0Q
Profe en la que dijo y=10 entonces es lineal??,j1nwW8eyD0Q,https://www.youtube.com/watch?v=j1nwW8eyD0Q
excelente explicación me aclaro muchas dudas,j1nwW8eyD0Q,https://www.youtube.com/watch?v=j1nwW8eyD0Q
"le recomiendo que  incursione en control no lineal, todo lo que es control es hermoso y sirve para hacer ejemplos de muchos temas fundamentales de matemáticas, si quiere material e información puede contactarme.",j1nwW8eyD0Q,https://www.youtube.com/watch?v=j1nwW8eyD0Q
